<?xml version="1.0" encoding="UTF-8"?>
<xs:schema xmlns:xs="http://www.w3.org/2001/XMLSchema">
    <xs:element name="employees">
        <xs:complexType>
        <xs:sequence>
            <xs:element name="employee" maxOccurs="unbounded">
                <xs:complexType>
                    <xs:sequence>
                        <xs:element name="id"></xs:element>
                        <xs:element name="name"></xs:element>
                        <xs:element name="department"></xs:element>
                        <xs:element name="courses">
                            <xs:complexType>
                                <xs:sequence>
                                    <xs:element name="course"></xs:element>
                                    <xs:element name="course"></xs:element>
                                </xs:sequence>
                            </xs:complexType>
                        </xs:element>
                    </xs:sequence>
                </xs:complexType>
            </xs:element>
        </xs:sequence>
        </xs:complexType>
        
    </xs:element>
</xs:schema>